IS 421:Systems Analysis:Course focus is on both traditional and object oriented systems analysis, with an emphasis upon developing competency in a wide range of modeling techniques.  Specific topics include  overview of the software development environment and project management; project selection, initiation, and planning; determining requirements; process modeling, including DFDs and use cases; logic modeling, including decision tables, sequence diagrams, and activity diagrams; introduction to Entity-Relationship Diagrams.  PREREQUISITE(S)  None::S0O,SpO,WiO,AuO,S0E,SpE,WiE,AuE:1
CSC 451:Database Design:Requirement analysis, conceptual design, logical design and implementation of relational databases. Emphasis will be on E-R modeling and E-R mapping, along with basic normalization and SQL for database implementation.   PREREQUISITE(S)  None::S1O,SpO,WiO,AuO,S1E,SpE,WiE,AuE:1
IS 422:System Design, Implementation, and Maintenance:Course focus is on both traditional and object oriented systems design.  Specific topics include  database design, including logical and physical design; Entity-Relationship diagrams, class diagrams,  form and report design; interface and dialogue design; design specifications, including structure charts and prototypes; designing for LANs and distributed systems, as well as the Internet; system implementation, including parallel and phased implementation, testing, documentation, and user training; system maintenance, including types of maintenance, controlling and coordinating maintenance requests, and configuration management.  Course ends with a multi-week case study applying the principles from both this course and IS 421, Systems Analysis.  PREREQUISITE(S)  IS 421 and CSC 451:IS 421 and CSC 451:SpO,WiO,AuO,SpE,WiE,AuE:1
IS 430:Fundamentals of IT Project Management:This course concentrates on monitoring, managing and controlling assets and resources on a single IT project.  Topics covered are risk management; procurement and contract management; time and cost estimating; controlling and tracking techniques; quality assurance; testing and audit.  Students will use common project management software for resource allocation and balancing. PREREQUISITE(S)  None::S1O,SpO,WiO,AuO,S2E,SpE,WiE,AuE:1
ECT 424:Enterprise Infrastructure:Introduction to modern infrastructure and the evolving technology environment.  Major topics include  computer networks, Internet infrastructure, Web 2.0, Enterprise 2.0, social media and networking, software as a service, content management systems, cloud computing,  and portal.::S1O,SpO,WiO,AuO,S1E,SpE,WiE,AuE:2
IS 556:Enterprise Project Management:This course covers how an enterprise coordinates and effectively manages all its IT projects and programs through program management and the IT program management office.  Students will learn the role of the IT program management office in establishing and maintaining the project and program infrastructure and in assisting project managers, program managers, and the executive steering committee.  Students will analyze the role of program management in coordinating the delivery of expected program benefits, in managing stakeholder expectations, and in establishing program governance.  PREREQUISITE(S)  IS 430 or PM 430:IS 430 or PM 430:SpO,WiO,AuO,SpE,WiE,AuE:2
IS 570:Enterprise System Implementation:Formerly IS 450.  This course is targeted towards information systems professionals who are involved in the planning and implementation of large scale, cross-functional enterprise systems.  Students will examine the characteristics of technology efforts that change and transform the way people perform their tasks and how the new technology structures the flows of information and decision making using workflow modeling methods.   Through case studies and exercises students gain insights into the elements of successful implementations leading to the preparation of a change management plan.  Emphasis is placed on developing mechanisms for communicating and training all affected agents.  PREREQUISITE(S)   IS 430 or PM 430 or completion of five or more other SoC MS level courses should contact the course instructor or an advisor.:IS 430 or PM 430 or completion of five or more other SoC MS level courses should contact the course instructor or an advisor:S2O,WiO,AuO,S2E,WiE,AuE:2
IS 535:Information Technology Investment Financial Analysis:This course focuses on the application of financial analysis and decision-making approaches to aid information technology investment decisions at the operational, project, tactical and strategic levels.  Students will learn how to apply a variety of financial methods -- breakeven analysis, present value analysis, profitability index, and return on investment to various IT investment decisions. The course will also address cost benefit analysis, outsourcing, balanced scorecard, and multi-factor scoring, benchmarking, and IT investment portfolio methods.  These techniques will prepare students to manage capital budgets, acquisition of system and application software, hardware, personnel, and professional services at project and system levels as well as enterprise investment portfolio. PREREQUISITE(S)  SE 477 or IS 565 or ACCT 500 or IS 430 or PM 430 or ECT 455:SE 477 or IS 565 or ACCT 500 or IS 430 or PM 430 or ECT 455:SpO,WiO,AuO,SpE,WiE,AuE:2
CNS 440:Information Security Management:Survey of information security management as it applies to information systems analysis, design, and operations. Managing information assets and the security infrastructure. Emphasis on managing security-related risk, as well as the process of developing, implementing, and maintaining organizational policies, standards, procedures, and guidelines. Identifying and evaluating information assets, threats, and vulnerabilities. Quantitative and qualitative risk analysis, risk mitigation, residual risk, and risk treatment as they relate to information security. Topics include information security vulnerabilities, threats, and risk management; security policies and standards; security audits; access controls; network perimeter protection, data protection; physical security; security education training and awareness. Introduction to compliance, as well as the CISSP domains.  PREREQUISITE(S)  None::SpO,WiO,AuO,SpE,WiE,AuE:3
ECT 556:Enterprise Architecture and Design:This is an advanced course on the design and planning of enterprise architecture that enables intra-/multi-enterprise collaboration and interoperability.  The emphasis is on the alignment between IT and organizational objectives through the integration of business architectures, data and information architecture, application architecture, technology architecture, interfaces and infrastructure. Topics include  frameworks, tools, and methodologies for enterprise architecture design; data and process modeling, application integration, implementation fundamentals, adaptability to changing organizational needs, and managing costs of implementation. Students will conduct case studies and develop architecture plans. Prerequisites  ECT 424 and SE 430:::3
IS 440:Collaborative Technologies for Leading Projects:Study of the process of virtual teaming with emphasis on facilitation of different time project activities and facilitation of same time meetings.  Students will learn how small group psychology and group communication theories inform specific behaviors in the design and leadership of meetings.  Several meeting types including information briefing, focus group, document writing, decision making, requirements gathering, and teaching/training will be explored.  In addition, the course surveys current collaboration technologies and discusses how to select among those technologies usability and fit to purpose of a meeting agenda.  DL students may be required to schedule same time sessions with the instructor and other DL students; see current quarter syllabus for more information on this point.  PREREQUISITE(S)  None::SpO,AuO,SpE,AuE:3
IS 483:Information Services and Operations:This course focuses on the operational aspects of information systems in organizations by examining the concepts, tools and techniques available to IS professionals responsible for the delivery of IT services.  Topics include the organization of the IT services; the procurement of hardware, software and vendor services; operation of data centers, help desks and user training, the development and use of RFPs (Request for Proposals) and SLAs (Service Level Agreements),  the integration of services and operations with application development project needs, and the role of capital and operating budgets.  PREREQUISITE(S)   Completion of five or more SoC MS level courses is required.:Completion of five or more SoC MS level courses is required:WiO,WiE:3
IS 500:Information Technology Leadership:Managing people ethically and effectively by applying a broad range of creative approaches to individual and team leadership within an Information Technology context.  Leadership methods studied include trait-based, skills-based, situational, contingency theory, path-goal theory, leader-member exchange theory, transformational, psychodynamic, and authentic leadership, as well as team leadership and the international, cultural, and ethical dimensions of leadership.  Students assess their leadership styles and design individualized development plans to strengthen existing skills and expand IT leadership capabilities by incorporating additional leadership dimensions.  PREREQUISITE(S)  IS 430 OR PM 430 OR SE 477:IS 430 OR PM 430 OR SE 477:SpO,SpE:3
MGT 500:Managing for Effective and Ethical Organizational Behavior:Students will critically examine ethical and creative methods to solve problems related to managing individuals and teams. Students utilize feedback from a developmental assessment center assessing their managerial and interpersonal skills. Personal development plans are created and skills developed throughout the course. Skill development domains include perception, attribution, motivation, learning leadership, communication, team development, managing change and conflict, decision-making, power and politics, and business ethics. Reserved for Kellstadt students or CDM students in select programs. Reserved for Kellstadt students or CDM students in select programs.::S1O,SpO,WiO,AuO,S0E,S1E,SpE,WiE,AuE:3
IS 505:Business Continuity/Disaster Recovery Theories and Strategies:This course focuses on the knowledge necessary for an organization to prepare for a variety of major disruptions (floods, earthquakes, terrorist attacks, etc.).  The goal is survival of the organization and its daily workflow despite major disruption.  Students learn to analyze and prioritize risks and determine criticality ratings that are used to determine survival strategies.  Students also learn how to organize employees to respond to a major disruption and how to document recovery plans.  Course content includes coverage of current industry trends, as well as planning for the survival of Information Technology functions within an organization.::S1O,SpO,WiO,AuO,S1E,SpE,WiE,AuE:3
IS 506:Business Continuity/Disaster Recovery Management and Tactics:The course prepares students to lead an organization's business continuity and disaster recovery plans.  Students learn the methodology needed to organize this function within an organization, evaluate an organization's business continuity and disaster recovery program according to established industry standards, and conduct a variety of quick-recovery drills.  Students also focus upon industry-related human resources issues, crisis communications, and policies and procedures for setting up a command center. Course content includes coverage of current industry trends, as well as managing the survival of Information Technology functions within an organization.  PREREQUISITE(S)   IS 505:IS 505:S2O,S2E,WiE:3
IS 535:Information Technology Investment Financial Analysis:This course focuses on the application of financial analysis and decision-making approaches to aid information technology investment decisions at the operational, project, tactical and strategic levels.  Students will learn how to apply a variety of financial methods -- breakeven analysis, present value analysis, profitability index, and return on investment to various IT investment decisions. The course will also address cost benefit analysis, outsourcing, balanced scorecard, and multi-factor scoring, benchmarking, and IT investment portfolio methods.  These techniques will prepare students to manage capital budgets, acquisition of system and application software, hardware, personnel, and professional services at project and system levels as well as enterprise investment portfolio. PREREQUISITE(S)  SE 477 or IS 565 or ACCT 500 or IS 430 or PM 430 or ECT 455:SE 477 or IS 565 or ACCT 500 or IS 430 or PM 430 or ECT 455:SpO,WiO,AuO,SpE,WiE,AuE:3
IS 536:Enterprise Cloud Computing:Cloud concepts, architecture, and service management, with particular emphasis upon identifying and analyzing potential business applications of cloud computing.  Students will conduct feasibility studies, detailing the advantages and disadvantages of implementing a cloud computing platform for specific applications, with particular emphasis upon financial considerations, business benefits, and security risks.  Students will develop the ability to evaluate alternatives and effectively argue in favor of their choices within the cloud computing knowledge domain.  They will be able to define, apply, and defend the need for standards and best practices.  Students will work within a project team following the principles of project management to design, build, and implement cloud applications.::WiO,WiE:3
IS 540:Global Information Technology:A study of the hardware, software, and techniques for using virtual information technologies to support teams working in a distributed, virtual, or global environments.  Topics include software survey and evaluation, software deployment within  organizational and trans-organizational contexts, trans-national vendor relationships, trans-border data flow, geographically dispersed software development, and integration of diverse technologies.  PREREQUISITE(S)  Completion of five or more SoC MS level courses is required.:Completion of five or more SoC MS level courses is required:WiO,WiE:3
IS 550:Enterprise Data Management:This course focuses on the technical concepts and managerial knowledge needed to define, integrate and govern centralized and distributed data for a wide range of application systems used at large, multinational corporations. Topics include data repository, data life cycle, DAMA-DMBOK, data stewardship, data asset valuation, enterprise data architecture, data modeling with meta-data, data security standards, master data, and data quality management.  PREREQUISITE(S)  CSC 451 or CSC 453 or CSC 455:CSC 451 or CSC 453 or CSC 455:AuO:3
IS 560:Enterprise Systems:An introduction to enterprise systems for data and process integration, including ERP systems.  Topics include the requirements of enterprise systems, application architecture, tools, and functionality of leading enterprise systems, life cycle and methodologies for systems integration, selection, and implementation strategies.  Also addressed are emerging trends for enterprise systems and relationship among component systems.  PREREQUISITE(S)  Advanced Standing:Advanced Standing:SpO,AuO,SpE,AuE:3
IS 565:IT Outsourcing:The course focuses on how organizations can use leverage of scale as a source for cost reduction; leverage of expertise for improved superior IT performance; leverage of access (e.g. location) to develop new strategies. Other topics covered include different types of sourcing strategies, sourcing maturity levels and best practices. PREREQUISITE(S)  Completion of five or more SoC MS level courses is required:Completion of five or more SoC MS level courses is required:WiO,WiE:3
IS 579:Virtual Software Teams Management:Application of project management principles, tools, and techniques to a virtual software development project; management of virtual software teams; planning, executing the plan, monitoring and controlling the development process. Work with project office (PMO) to set templates for reporting and common processes and standards; set milestones and their deliverables; establish communication medium for the virtual team.  PREREQUISITE(S)  PM 430 or IS 430:PM 430 or IS 430:SpO:3
IS 580:Technology Entrepreneurship:In-depth examination of the entrepreneurial process within technology intensive ventures. Roles of entrepreneurs and their start-up teams. Suitable business models and strategies. Legal issues and intellectual property. Financial issues and venture resources. Role of the customer and entrepreneurial marketing. Students will analyze and present case studies of technology entrepreneurial ventures. Students will develop a marketing plan and a business plan for a technology-intensive entrepreneurial venture of their choice.  PREREQUISITE(S)  Completion of the foundation phase.:Completion of the foundation phase:SpO:3
IS 577:Information Systems Policies and Strategies:This capstone course emphasizes the planning and management of information technologies and related resources at the corporate level. Topics covered include assessment of information technologies, tracking emerging technologies and trends, managing portfolio resources and matching them to business needs, technology transfer, end-user computing, outsourcing, theoretical models, strategic applications and strategic IT planning. Students are encouraged to take this course toward the end of their study.  PREREQUISITE(S) Completion of ten or more SoC MS level courses is required.::S1O,WiO,S1E,WiE:4
